reference;libelle;marque
iG3NS35;rutrum eu, ultrices sit;Pellentesque Foundation
ef+87_V2;at risus. Nunc ac sem ut dolor;Nec Ante Associates
KJ-31MNp8;pharetra ut,;Primis Corporation
BE-54QNb1;tortor at risus.;Primis Corporation
eQ3HK14;facilisis vitae, orci. Phasellus dapibus quam quis diam.;Pellentesque Foundation
eY4WB23;Cras sed leo.;Pellentesque Foundation
i7EE8-W;magna. Cras convallis convallis dolor. Quisque tincidunt pede;Sagittis Duis
bs+01_G7;porta elit, a feugiat;Nec Ante Associates
oB7PB36;vitae velit egestas lacinia. Sed congue, elit sed;Pellentesque Foundation
aB7EY23;vitae sodales nisi;Pellentesque Foundation
xy+83_X2;Donec dignissim magna a tortor. Nunc commodo;Nec Ante Associates
u2EU5-G;Quisque purus sapien, gravida non, sollicitudin;Sagittis Duis
ZM-51JCz2;egestas blandit. Nam nulla magna, malesuada;Primis Corporation
eq+27_G6;sagittis. Duis gravida. Praesent eu nulla at;Nec Ante Associates
be+16_M2;magna, malesuada vel, convallis in, cursus et, eros. Proin ultrices.;Nec Ante Associates
i5II5-L;Phasellus elit pede, malesuada vel,;Sagittis Duis
lg+68_U3;lorem, eget mollis lectus pede et risus. Quisque;Nec Ante Associates
u8OI1-J;lobortis. Class aptent taciti sociosqu ad;Sagittis Duis
jx+08_Z4;nec ligula consectetuer;Nec Ante Associates
BG-66ICi4;molestie orci;Primis Corporation
uX4SE84;Donec fringilla. Donec feugiat metus sit amet ante. Vivamus;Pellentesque Foundation
RJ-31JWq9;quis, pede. Suspendisse dui. Fusce diam nunc, ullamcorper eu,;Primis Corporation
DP-45CFg2;sem ut cursus luctus, ipsum leo elementum sem,;Primis Corporation
iZ3XV44;sollicitudin;Pellentesque Foundation
gf+44_F5;ipsum primis in faucibus orci luctus et ultrices;Nec Ante Associates
o4IE9-T;Mauris vel turpis. Aliquam adipiscing lobortis risus. In mi pede,;Sagittis Duis
JB-38MWp5;Integer tincidunt aliquam arcu. Aliquam ultrices;Primis Corporation
ck+78_E3;eu eros. Nam consequat dolor;Nec Ante Associates
YB-25YCd7;cursus;Primis Corporation
e5IU1-M;ligula. Nullam enim. Sed nulla ante, iaculis nec, eleifend;Sagittis Duis
AD-74YMb4;vitae, erat. Vivamus nisi. Mauris nulla. Integer;Primis Corporation
eV6XR56;Suspendisse ac metus vitae velit egestas lacinia.;Pellentesque Foundation
oO7EW54;et ipsum cursus vestibulum. Mauris magna.;Pellentesque Foundation
CE-68KZj4;dictum. Phasellus in felis. Nulla tempor augue ac ipsum.;Primis Corporation
FN-34BWm4;at, velit. Pellentesque ultricies dignissim lacus.;Primis Corporation
e8OE4-F;mollis. Phasellus libero mauris, aliquam;Sagittis Duis
uI7UB44;magna a neque. Nullam;Pellentesque Foundation
dt+82_D3;non massa non ante bibendum;Nec Ante Associates
wc+32_I1;sit amet, faucibus ut, nulla. Cras eu tellus eu;Nec Ante Associates
a5UO7-D;ornare lectus justo;Sagittis Duis
OY-64YNm2;commodo ipsum. Suspendisse non leo.;Primis Corporation
MD-33UOb6;elit, pharetra;Primis Corporation
PP-24DLq4;laoreet, libero et;Primis Corporation
UB-63RLb1;amet, risus. Donec nibh enim, gravida sit;Primis Corporation
MS-64TEt7;aliquet molestie tellus. Aenean egestas hendrerit;Primis Corporation
i5UI4-R;dui;Sagittis Duis
aI1UR73;suscipit nonummy. Fusce fermentum fermentum;Pellentesque Foundation
oO9DZ32;pretium aliquet, metus urna convallis erat, eget tincidunt dui augue;Pellentesque Foundation
e6EO5-U;tincidunt congue turpis. In condimentum. Donec at arcu.;Sagittis Duis
QX-61FKo6;consectetuer adipiscing elit. Curabitur sed tortor. Integer aliquam adipiscing lacus.;Primis Corporation
a2IO9-B;urna. Vivamus molestie dapibus ligula. Aliquam erat volutpat.;Sagittis Duis
tt+14_M6;magna, malesuada vel, convallis in, cursus et, eros. Proin ultrices.;Nec Ante Associates
XM-80MAr9;iaculis, lacus;Primis Corporation
HJ-76REh2;nunc interdum feugiat. Sed;Primis Corporation
GF-43GGg5;eget, venenatis a, magna. Lorem;Primis Corporation
i9IA4-N;Nam consequat dolor vitae dolor. Donec;Sagittis Duis
MH-29FMq3;Etiam gravida molestie arcu. Sed eu nibh;Primis Corporation
ud+07_R6;senectus et netus;Nec Ante Associates
sn+61_A8;id, blandit at, nisi. Cum sociis natoque penatibus et magnis;Nec Ante Associates
vh+27_H3;amet, consectetuer adipiscing elit. Etiam laoreet, libero;Nec Ante Associates
eH8PK85;sollicitudin orci;Pellentesque Foundation
OE-70SYi4;in consequat enim diam vel arcu.;Primis Corporation
aF7MD31;pede ac urna. Ut tincidunt vehicula;Pellentesque Foundation
i8UO1-T;imperdiet ornare. In faucibus. Morbi vehicula.;Sagittis Duis
jm+88_C3;odio, auctor vitae, aliquet nec,;Nec Ante Associates
o5EI7-V;semper rutrum. Fusce dolor quam, elementum at,;Sagittis Duis
UO-24HRh5;Vivamus molestie dapibus ligula. Aliquam erat;Primis Corporation
sc+25_K9;a tortor. Nunc;Nec Ante Associates
EH-42MVr4;quam dignissim pharetra. Nam ac nulla. In tincidunt congue;Primis Corporation
UC-71QEn5;in lobortis tellus justo sit amet nulla. Donec non;Primis Corporation
o1OE0-O;est ac mattis semper, dui lectus rutrum urna, nec;Sagittis Duis
a2IE7-M;In condimentum. Donec at;Sagittis Duis
BK-83GYc3;Curabitur vel lectus. Cum sociis natoque;Primis Corporation
uL5RO42;ligula. Aenean gravida nunc;Pellentesque Foundation
oX5NQ52;mi tempor lorem,;Pellentesque Foundation
LT-25RYq4;a nunc. In;Primis Corporation
wb+29_F9;scelerisque;Nec Ante Associates
eY7LG88;sapien,;Pellentesque Foundation
eG7LH75;pede. Nunc;Pellentesque Foundation
o3IA4-D;Nunc commodo auctor velit. Aliquam nisl. Nulla eu neque pellentesque;Sagittis Duis
yc+73_C5;non, egestas a, dui. Cras pellentesque. Sed dictum. Proin;Nec Ante Associates
nq+56_I7;ut, pellentesque eget, dictum;Nec Ante Associates
IV-85DFx2;eget metus eu;Primis Corporation
LV-23WOx5;Vestibulum ut eros non enim commodo hendrerit.;Primis Corporation
WG-65OVv7;in sodales elit;Primis Corporation
bg+53_W2;ipsum non arcu. Vivamus sit amet risus.;Nec Ante Associates
re+81_M4;egestas lacinia.;Nec Ante Associates
aI5JT87;Nunc mauris sapien, cursus in, hendrerit consectetuer, cursus;Pellentesque Foundation
oL5KG37;at, iaculis quis, pede. Praesent eu dui. Cum sociis;Pellentesque Foundation
oT1LE56;interdum. Curabitur dictum. Phasellus;Pellentesque Foundation
oA2OD46;quis accumsan convallis, ante lectus convallis est,;Pellentesque Foundation
e2OA4-A;orci quis lectus. Nullam suscipit, est;Sagittis Duis
