reference;libelle;marque
nw+64_Q6;auctor ullamcorper, nisl arcu;Nec Ante Associates
CP-76DNv7;Aenean egestas hendrerit neque. In ornare sagittis;Primis Corporation
i5AI5-T;magna a tortor. Nunc;Sagittis Duis
i3EU0-L;rhoncus id,;Sagittis Duis
oQ4OV42;sem semper erat, in consectetuer ipsum;Pellentesque Foundation
KF-68CXh7;lacus. Ut nec;Primis Corporation
i0II0-J;sed;Sagittis Duis
ok+61_G3;feugiat. Lorem ipsum;Nec Ante Associates
iT5XO73;congue. In scelerisque scelerisque dui. Suspendisse ac;Pellentesque Foundation
TC-15LEj5;scelerisque neque sed;Primis Corporation
EO-14MKm2;nulla ante, iaculis nec,;Primis Corporation
o1EE7-X;lorem, vehicula et, rutrum eu, ultrices sit amet, risus.;Sagittis Duis
YE-65VSr7;vulputate ullamcorper magna. Sed eu eros. Nam consequat dolor vitae;Primis Corporation
lp+17_L3;aliquam eu, accumsan sed, facilisis;Nec Ante Associates
dh+60_H3;In at pede. Cras vulputate;Nec Ante Associates
u6OO4-E;lacus. Aliquam rutrum;Sagittis Duis
WM-74UBl2;mollis vitae, posuere at, velit.;Primis Corporation
WA-29JGr1;libero lacus, varius et, euismod et, commodo at, libero. Morbi;Primis Corporation
wo+47_J3;interdum. Sed;Nec Ante Associates
o6IE9-S;vitae diam. Proin;Sagittis Duis
BK-74EJt1;erat vitae risus.;Primis Corporation
i3EU4-U;cubilia Curae Phasellus ornare. Fusce mollis. Duis sit;Sagittis Duis
i2AU9-O;blandit at, nisi. Cum sociis;Sagittis Duis
zp+24_O2;elit, pellentesque a, facilisis non,;Nec Ante Associates
eC9LW43;enim;Pellentesque Foundation
hc+13_M9;Vivamus non lorem vitae odio sagittis;Nec Ante Associates
DZ-62QSw5;eget magna. Suspendisse;Primis Corporation
MY-72PDk8;ac tellus. Suspendisse sed dolor. Fusce mi lorem, vehicula et,;Primis Corporation
UK-68WLj7;ac mattis ornare, lectus ante;Primis Corporation
VJ-11JWi8;lobortis augue scelerisque mollis. Phasellus libero;Primis Corporation
u3OI8-X;ut quam vel sapien imperdiet ornare. In;Sagittis Duis
vz+62_M8;augue, eu tempor erat neque non quam. Pellentesque habitant;Nec Ante Associates
uR3BP22;rhoncus. Donec est.;Pellentesque Foundation
iO8TM69;convallis ligula. Donec luctus aliquet odio.;Pellentesque Foundation
oI1YW48;tempus non, lacinia at, iaculis quis, pede.;Pellentesque Foundation
YH-23QCg4;laoreet;Primis Corporation
ST-28YFt9;ornare, libero at;Primis Corporation
YB-58IVs4;ut lacus. Nulla;Primis Corporation
o4OE6-P;mauris. Integer sem;Sagittis Duis
oP4DQ62;Nullam enim. Sed nulla ante, iaculis nec, eleifend non,;Pellentesque Foundation
uV6RS31;Quisque porttitor eros nec tellus. Nunc lectus pede,;Pellentesque Foundation
aU7QQ63;erat vel pede blandit congue. In scelerisque scelerisque dui. Suspendisse;Pellentesque Foundation
pj+11_D1;justo nec ante. Maecenas mi felis, adipiscing fringilla, porttitor;Nec Ante Associates
xi+46_M3;fames ac turpis egestas. Aliquam;Nec Ante Associates
jd+52_D2;ligula. Nullam;Nec Ante Associates
iC0FU38;in consequat enim diam vel arcu.;Pellentesque Foundation
cw+78_D7;ut quam vel sapien imperdiet ornare.;Nec Ante Associates
mo+34_P6;Suspendisse sagittis. Nullam vitae diam. Proin dolor.;Nec Ante Associates
xs+31_M5;nascetur ridiculus mus. Donec dignissim;Nec Ante Associates
su+22_Z9;malesuada ut, sem.;Nec Ante Associates
dq+83_S4;quis lectus. Nullam suscipit, est ac facilisis facilisis, magna tellus;Nec Ante Associates
mh+30_E5;non, hendrerit id, ante. Nunc;Nec Ante Associates
XZ-13GEp4;a sollicitudin orci;Primis Corporation
NF-36YRp8;pede ac urna. Ut;Primis Corporation
DR-28XKa8;Curabitur sed tortor. Integer;Primis Corporation
aV6LI82;fermentum vel, mauris.;Pellentesque Foundation
qr+79_J7;erat. Sed nunc est, mollis non, cursus non, egestas;Nec Ante Associates
ai+63_M1;sagittis. Duis gravida. Praesent eu nulla;Nec Ante Associates
oN4NI42;eu nibh vulputate mauris sagittis placerat.;Pellentesque Foundation
aM3IL22;vitae sodales nisi magna sed dui. Fusce aliquam,;Pellentesque Foundation
aE0DP45;sagittis augue,;Pellentesque Foundation
u4AE5-H;Phasellus nulla. Integer vulputate, risus a ultricies adipiscing, enim;Sagittis Duis
FK-42TYd5;volutpat. Nulla dignissim. Maecenas;Primis Corporation
iR2IO71;ullamcorper. Duis cursus, diam;Pellentesque Foundation
gi+54_G3;neque. Nullam ut nisi a odio;Nec Ante Associates
vs+41_X9;sagittis placerat. Cras dictum ultricies ligula.;Nec Ante Associates
eT2EB26;turpis non;Pellentesque Foundation
WK-01PNc7;sit amet, consectetuer adipiscing elit. Aliquam auctor, velit eget laoreet;Primis Corporation
DJ-99BTz2;faucibus id, libero. Donec consectetuer mauris id;Primis Corporation
PV-12RYo5;libero. Donec consectetuer mauris id sapien.;Primis Corporation
WH-16WWm6;cursus. Nunc mauris elit,;Primis Corporation
ne+61_D3;sociis natoque penatibus et;Nec Ante Associates
UI-74LXl8;dolor sit amet, consectetuer adipiscing elit. Etiam laoreet,;Primis Corporation
i6EO3-E;metus eu erat semper;Sagittis Duis
i0EE7-F;ipsum non arcu. Vivamus sit amet;Sagittis Duis
BT-46MUl8;nec ligula consectetuer rhoncus.;Primis Corporation
uI3MS23;vitae odio sagittis semper. Nam tempor diam;Pellentesque Foundation
DH-42RFd8;justo. Proin non massa non ante;Primis Corporation
e1IA4-X;Vivamus nisi. Mauris nulla. Integer;Sagittis Duis
ye+24_C3;elit sed consequat auctor, nunc nulla vulputate dui, nec;Nec Ante Associates
AN-83XBa7;Sed pharetra, felis eget;Primis Corporation
oS6HE65;nec ante. Maecenas mi felis,;Pellentesque Foundation
zu+45_C4;rutrum, justo. Praesent luctus. Curabitur egestas nunc;Nec Ante Associates
i1EO7-T;libero. Morbi accumsan;Sagittis Duis
FE-07STo8;laoreet,;Primis Corporation
uO4OR62;Duis cursus, diam at;Pellentesque Foundation
jk+01_F8;eu odio tristique pharetra.;Nec Ante Associates
iQ1OQ53;sem molestie sodales. Mauris;Pellentesque Foundation
ig+58_M7;non, dapibus;Nec Ante Associates
a6IO1-P;lorem ac risus. Morbi metus. Vivamus;Sagittis Duis
iG3BD38;mi eleifend egestas. Sed pharetra,;Pellentesque Foundation
dr+44_A4;mi lorem, vehicula et, rutrum eu, ultrices;Nec Ante Associates
eT5XQ71;risus. Donec egestas. Duis ac;Pellentesque Foundation
JJ-15SLj3;pellentesque. Sed dictum. Proin eget odio. Aliquam vulputate ullamcorper magna.;Primis Corporation
VU-64IWh3;leo. Morbi neque tellus,;Primis Corporation
QP-33VFb2;nibh vulputate mauris sagittis placerat. Cras dictum;Primis Corporation
i3EE9-S;a, aliquet vel,;Sagittis Duis
HV-87YQe5;ridiculus mus. Proin vel;Primis Corporation
iW8WY37;ornare,;Pellentesque Foundation
e4OU2-E;amet, consectetuer;Sagittis Duis
i2OU8-D;ipsum dolor sit amet, consectetuer adipiscing elit. Curabitur;Sagittis Duis
QC-14VVw6;Quisque varius. Nam porttitor scelerisque neque. Nullam nisl. Maecenas;Primis Corporation
e1II4-T;mi eleifend egestas. Sed pharetra,;Sagittis Duis
DB-52OSw9;Aenean egestas hendrerit neque. In ornare sagittis;Primis Corporation
wl+48_F6;id, libero. Donec;Nec Ante Associates
iP9BH19;cursus a, enim. Suspendisse aliquet, sem ut cursus luctus,;Pellentesque Foundation
u3AU5-S;lorem lorem, luctus ut, pellentesque eget,;Sagittis Duis
e6OI7-G;posuere at,;Sagittis Duis
u1AO3-N;Nunc lectus pede, ultrices;Sagittis Duis
uG6NQ44;dui augue eu tellus. Phasellus elit pede,;Pellentesque Foundation
jj+03_D7;dui, semper et,;Nec Ante Associates
e8EE5-A;tellus sem mollis dui, in;Sagittis Duis
VB-32LEy1;a felis ullamcorper viverra. Maecenas iaculis aliquet diam. Sed;Primis Corporation
aC0CG84;Sed molestie. Sed;Pellentesque Foundation
SB-65YDh4;posuere at, velit. Cras;Primis Corporation
BH-87QHs7;ipsum ac mi eleifend;Primis Corporation
DY-69NSp5;elit. Nulla facilisi. Sed;Primis Corporation
i4EI3-R;Cras eu tellus eu augue;Sagittis Duis
ws+76_I5;Donec egestas. Duis ac arcu. Nunc mauris. Morbi non;Nec Ante Associates
XH-17CJn3;Donec dignissim magna a tortor.;Primis Corporation
fs+33_F9;purus, in molestie tortor nibh sit amet;Nec Ante Associates
im+55_M7;vel arcu. Curabitur ut odio vel est tempor bibendum.;Nec Ante Associates
my+54_S7;ac;Nec Ante Associates
DY-77GFm8;Quisque ac libero nec ligula consectetuer rhoncus.;Primis Corporation
iJ3CS34;faucibus. Morbi vehicula.;Pellentesque Foundation
o7EA7-B;netus et malesuada fames ac turpis egestas.;Sagittis Duis
GJ-60YFo4;ridiculus mus. Aenean eget magna.;Primis Corporation
bu+64_Q6;lectus convallis est, vitae sodales nisi magna sed;Nec Ante Associates
uH4RV75;auctor quis, tristique ac, eleifend vitae, erat.;Pellentesque Foundation
eY8BL56;sem. Nulla interdum. Curabitur;Pellentesque Foundation
hk+13_T8;Cras dictum ultricies ligula. Nullam;Nec Ante Associates
fh+59_Y9;lobortis ultrices. Vivamus rhoncus. Donec est. Nunc ullamcorper,;Nec Ante Associates
e1OU5-B;nibh. Quisque;Sagittis Duis
i3AE5-O;nec urna suscipit nonummy. Fusce;Sagittis Duis
oV6HW43;Donec porttitor tellus non magna. Nam;Pellentesque Foundation
uh+39_C9;Nullam enim. Sed nulla ante, iaculis nec, eleifend non,;Nec Ante Associates
vs+59_D4;consectetuer euismod est arcu ac orci. Ut;Nec Ante Associates
KH-76KPs7;viverra. Donec tempus, lorem;Primis Corporation
DP-04ZCp7;tempus non, lacinia at, iaculis quis,;Primis Corporation
db+85_G6;felis purus;Nec Ante Associates
tt+61_A3;Proin non massa non ante bibendum ullamcorper. Duis;Nec Ante Associates
DJ-67UDf2;in felis. Nulla tempor;Primis Corporation
sl+78_M1;accumsan neque et nunc. Quisque ornare tortor at;Nec Ante Associates
iT3HS43;placerat, orci;Pellentesque Foundation
uD8YY84;Ut sagittis lobortis mauris. Suspendisse aliquet molestie;Pellentesque Foundation
LL-68DJk6;tempor bibendum. Donec felis orci, adipiscing non, luctus sit;Primis Corporation
oT6RL48;Quisque ornare tortor at risus. Nunc ac sem;Pellentesque Foundation
ro+05_J2;lacus;Nec Ante Associates
yu+23_T2;vestibulum nec, euismod in, dolor. Fusce feugiat.;Nec Ante Associates
iI6SH55;luctus lobortis. Class aptent taciti sociosqu ad litora torquent;Pellentesque Foundation
iL8XB29;urna;Pellentesque Foundation
DW-01OTe4;interdum. Nunc sollicitudin commodo ipsum. Suspendisse non leo.;Primis Corporation
qg+23_K7;parturient montes, nascetur ridiculus mus. Proin;Nec Ante Associates
e2II6-T;cursus. Integer mollis. Integer tincidunt aliquam arcu. Aliquam;Sagittis Duis
oM5TO37;nec ligula consectetuer rhoncus. Nullam;Pellentesque Foundation
DN-71MYb1;arcu. Morbi sit amet massa. Quisque porttitor eros;Primis Corporation
VU-53HLt1;Phasellus vitae mauris sit;Primis Corporation
aU1RT26;rutrum urna, nec luctus felis purus ac tellus.;Pellentesque Foundation
uh+26_L7;gravida. Praesent eu nulla at sem molestie sodales.;Nec Ante Associates
e8IE8-R;risus a ultricies adipiscing, enim mi;Sagittis Duis
zz+85_U6;non nisi. Aenean eget metus. In nec orci.;Nec Ante Associates
YN-70PBk3;mi felis, adipiscing fringilla, porttitor vulputate, posuere vulputate, lacus.;Primis Corporation
eO1KV59;tellus faucibus leo, in lobortis;Pellentesque Foundation
oD1CP32;vitae odio sagittis semper. Nam tempor diam dictum;Pellentesque Foundation
PL-02IEu7;Morbi vehicula. Pellentesque tincidunt tempus risus. Donec egestas. Duis;Primis Corporation
wt+81_S9;eleifend non, dapibus rutrum, justo. Praesent luctus. Curabitur;Nec Ante Associates
nf+22_F8;ac mi eleifend egestas. Sed;Nec Ante Associates
eQ1TH66;Morbi non sapien molestie;Pellentesque Foundation
el+29_V5;conubia nostra, per inceptos hymenaeos. Mauris ut quam vel;Nec Ante Associates
ap+58_C5;nunc sed libero. Proin;Nec Ante Associates
uL1DB95;turpis nec mauris blandit;Pellentesque Foundation
XM-13BZe9;hendrerit id, ante. Nunc mauris sapien,;Primis Corporation
sz+75_K7;Fusce mollis. Duis sit amet diam eu;Nec Ante Associates
u2EO7-F;luctus aliquet odio. Etiam ligula tortor, dictum eu, placerat;Sagittis Duis
LG-63EOw5;Suspendisse ac;Primis Corporation
go+29_G4;Aliquam rutrum;Nec Ante Associates
KK-83GQd7;et magnis;Primis Corporation
IY-81EEy5;consequat enim diam vel arcu. Curabitur;Primis Corporation
FT-34LPj5;vehicula et, rutrum eu, ultrices sit amet,;Primis Corporation
u0EE8-A;lorem tristique aliquet. Phasellus fermentum convallis ligula.;Sagittis Duis
DB-36QBv8;non massa non ante bibendum ullamcorper. Duis cursus, diam;Primis Corporation
i9II9-X;Suspendisse ac metus vitae velit egestas lacinia.;Sagittis Duis
NO-84IEy7;risus varius orci, in consequat enim diam vel arcu. Curabitur;Primis Corporation
i9AI5-I;imperdiet dictum magna. Ut tincidunt orci quis lectus. Nullam;Sagittis Duis
PO-43HOf8;ac mattis velit justo nec ante. Maecenas mi felis,;Primis Corporation
SK-12SSb2;ut, nulla. Cras eu tellus eu;Primis Corporation
oP6MM95;at sem molestie sodales. Mauris blandit enim consequat;Pellentesque Foundation
ca+67_A3;lorem. Donec elementum, lorem ut aliquam;Nec Ante Associates
a9AO3-M;gravida sit amet, dapibus;Sagittis Duis
aV5FW97;Cras pellentesque. Sed dictum. Proin eget;Pellentesque Foundation
oJ4PK31;sem ut;Pellentesque Foundation
i3AA1-X;magna. Praesent interdum ligula eu enim.;Sagittis Duis
JI-41BRg9;Curabitur ut odio vel est;Primis Corporation
YJ-87RNn8;at augue id ante;Primis Corporation
eu+27_C4;non justo. Proin non massa non;Nec Ante Associates
u0II2-V;Donec tincidunt.;Sagittis Duis
e5IO5-I;elit, dictum eu,;Sagittis Duis
i5OI1-X;Mauris magna. Duis dignissim;Sagittis Duis
oH3DI25;arcu. Sed et libero. Proin mi. Aliquam;Pellentesque Foundation
JW-13SNr1;in lobortis tellus;Primis Corporation
i3IO6-Q;Quisque fringilla euismod enim. Etiam gravida molestie arcu. Sed;Sagittis Duis
e8EU4-F;magna sed dui. Fusce aliquam, enim nec;Sagittis Duis
CI-47CSj4;tellus;Primis Corporation
o4EE4-Y;Class aptent taciti sociosqu ad;Sagittis Duis
uB0IN83;luctus lobortis. Class;Pellentesque Foundation
DU-86THp6;dui lectus rutrum urna,;Primis Corporation
oX5FD48;pellentesque. Sed dictum. Proin;Pellentesque Foundation
i5AE5-F;Sed pharetra,;Sagittis Duis
a8II6-U;Pellentesque ut ipsum ac mi eleifend egestas. Sed pharetra, felis;Sagittis Duis
KI-89XVv8;sagittis augue, eu tempor erat;Primis Corporation
iE6JF52;mi. Aliquam gravida mauris ut;Pellentesque Foundation
NH-36XGr6;mauris ipsum;Primis Corporation
NF-95MPk7;libero mauris, aliquam;Primis Corporation
VM-88USl2;Vivamus nibh dolor, nonummy ac, feugiat non, lobortis;Primis Corporation
oL3OB78;Etiam ligula tortor, dictum eu, placerat eget, venenatis a,;Pellentesque Foundation
JM-62TUg8;In condimentum. Donec at arcu. Vestibulum ante ipsum;Primis Corporation
mp+64_J2;sapien. Aenean massa. Integer vitae nibh.;Nec Ante Associates
do+83_U5;mauris. Morbi non sapien;Nec Ante Associates
BJ-28DXj4;amet diam eu dolor egestas;Primis Corporation
a7II9-X;ultricies adipiscing, enim mi tempor lorem, eget;Sagittis Duis
uH5SG67;egestas. Aliquam nec enim. Nunc ut;Pellentesque Foundation
af+77_T1;eleifend vitae, erat. Vivamus;Nec Ante Associates
cs+42_V2;diam. Sed diam lorem, auctor quis, tristique ac, eleifend;Nec Ante Associates
o7AI8-X;laoreet, libero et tristique pellentesque,;Sagittis Duis
u0AO5-M;et magnis dis parturient montes, nascetur ridiculus;Sagittis Duis
VF-44ZHq4;Curabitur dictum. Phasellus in felis.;Primis Corporation
ha+63_X5;pharetra sed, hendrerit a, arcu.;Nec Ante Associates
eU7MA55;ipsum. Donec sollicitudin;Pellentesque Foundation
KF-93TXr7;lorem. Donec elementum,;Primis Corporation
fb+95_S3;tincidunt aliquam arcu. Aliquam;Nec Ante Associates
eW1OR47;odio a purus. Duis elementum,;Pellentesque Foundation
oD2NB61;vel arcu eu odio tristique pharetra.;Pellentesque Foundation
o3OU7-U;montes, nascetur ridiculus;Sagittis Duis
uD8GB15;convallis convallis dolor. Quisque tincidunt pede ac urna. Ut;Pellentesque Foundation
a5UA7-B;nec tempus mauris;Sagittis Duis
mc+32_K6;Vivamus sit amet;Nec Ante Associates
XY-17XGx8;lacus. Quisque purus sapien, gravida non,;Primis Corporation
kf+19_F2;faucibus ut, nulla.;Nec Ante Associates
DE-13MTg8;Fusce aliquam, enim;Primis Corporation
i3EE1-J;sem mollis dui, in sodales elit erat;Sagittis Duis
io+70_Q7;eu sem. Pellentesque ut ipsum ac mi eleifend egestas. Sed;Nec Ante Associates
it+73_I8;torquent per conubia nostra, per inceptos;Nec Ante Associates
iO4XY89;lectus justo eu arcu. Morbi sit amet massa. Quisque porttitor;Pellentesque Foundation
JM-21QHr5;et, eros. Proin ultrices. Duis volutpat nunc sit amet metus.;Primis Corporation
iV7FC33;taciti sociosqu ad litora torquent per conubia;Pellentesque Foundation
vo+22_F1;at risus. Nunc;Nec Ante Associates
ym+65_X2;mauris, aliquam eu, accumsan sed,;Nec Ante Associates
oC2CX85;facilisis, magna;Pellentesque Foundation
eU5NJ54;suscipit nonummy.;Pellentesque Foundation
il+66_I4;mauris eu elit. Nulla facilisi. Sed neque. Sed;Nec Ante Associates
o6OI6-Y;pretium aliquet,;Sagittis Duis
iR3GU13;elit, pharetra ut, pharetra sed, hendrerit;Pellentesque Foundation
ek+35_L4;pharetra. Quisque ac libero nec ligula consectetuer rhoncus.;Nec Ante Associates
ta+54_B8;urna. Nunc;Nec Ante Associates
xl+48_S1;cursus non, egestas a, dui. Cras pellentesque. Sed dictum.;Nec Ante Associates
eS4EY93;Nulla eu neque pellentesque massa lobortis ultrices. Vivamus;Pellentesque Foundation
iG6WB43;nibh. Aliquam ornare, libero;Pellentesque Foundation
o9UI4-T;sed, hendrerit a, arcu. Sed et libero. Proin mi. Aliquam;Sagittis Duis
iH9OQ28;risus odio, auctor vitae,;Pellentesque Foundation
e1II9-W;sodales at, velit. Pellentesque;Sagittis Duis
o8EE8-M;erat vel pede blandit congue.;Sagittis Duis
wd+22_C6;lorem.;Nec Ante Associates
o7AE1-I;tincidunt pede ac urna. Ut tincidunt vehicula;Sagittis Duis
uJ2DW74;Aliquam vulputate ullamcorper magna. Sed;Pellentesque Foundation
eI1YQ55;mi. Aliquam gravida mauris;Pellentesque Foundation
JK-43EAf9;odio, auctor vitae, aliquet nec, imperdiet;Primis Corporation
oZ4CN35;Proin nisl sem, consequat;Pellentesque Foundation
PE-00MOw4;Nullam suscipit, est;Primis Corporation
DO-17DBf8;et ultrices posuere cubilia Curae Phasellus ornare. Fusce;Primis Corporation
mb+23_D8;dolor;Nec Ante Associates
iU2YY28;Donec felis orci,;Pellentesque Foundation
CL-48IFb6;amet luctus;Primis Corporation
ed+74_Z3;non enim;Nec Ante Associates
o2EI7-R;et malesuada fames ac turpis egestas. Aliquam;Sagittis Duis
NU-59TBm5;sem. Pellentesque ut;Primis Corporation
PL-81NJj8;nunc sed pede.;Primis Corporation
PB-01YRc5;cursus luctus, ipsum leo elementum sem, vitae aliquam;Primis Corporation
eN3JG54;viverra. Donec tempus, lorem fringilla ornare placerat, orci;Pellentesque Foundation
i8OU3-L;ipsum. Phasellus vitae mauris sit amet lorem semper;Sagittis Duis
uI2AC49;neque. In ornare sagittis felis. Donec tempor, est ac mattis;Pellentesque Foundation
kf+16_A5;Curabitur egestas nunc sed libero.;Nec Ante Associates
iB1ND33;non, dapibus rutrum, justo. Praesent luctus. Curabitur egestas nunc;Pellentesque Foundation
aN2RC97;viverra. Donec tempus, lorem fringilla ornare placerat, orci lacus;Pellentesque Foundation
oQ5PA77;semper pretium neque. Morbi quis urna. Nunc quis arcu;Pellentesque Foundation
u5EO7-D;cursus luctus, ipsum leo elementum sem,;Sagittis Duis
TV-21CCk5;pharetra ut, pharetra sed,;Primis Corporation
BP-96PRw9;luctus et;Primis Corporation
iS7UJ31;eros. Nam consequat dolor vitae dolor. Donec fringilla. Donec feugiat;Pellentesque Foundation
kb+77_T7;Donec tempus,;Nec Ante Associates
FI-89EXb2;interdum. Curabitur dictum.;Primis Corporation
aU7SG73;eget nisi dictum augue malesuada malesuada. Integer id magna et;Pellentesque Foundation
QK-64ZTx8;Nullam enim. Sed nulla ante, iaculis nec, eleifend;Primis Corporation
WJ-80QRy9;Phasellus nulla.;Primis Corporation
oD6KG87;porttitor;Pellentesque Foundation
hb+66_P5;commodo auctor velit. Aliquam;Nec Ante Associates
qx+45_E1;nisi. Aenean eget;Nec Ante Associates
o2UO5-B;vitae odio sagittis semper. Nam tempor;Sagittis Duis
i7AU5-D;lectus, a sollicitudin orci sem eget massa. Suspendisse eleifend.;Sagittis Duis
i6UI3-Y;arcu. Curabitur ut odio vel est tempor bibendum. Donec felis;Sagittis Duis
uw+54_D8;aliquam adipiscing lacus. Ut;Nec Ante Associates
e9IO2-V;euismod est arcu ac orci.;Sagittis Duis
us+05_H6;ante. Vivamus non lorem vitae;Nec Ante Associates
iD7IE76;sapien imperdiet ornare. In faucibus. Morbi;Pellentesque Foundation
aq+81_U4;magna. Duis dignissim tempor arcu. Vestibulum ut eros;Nec Ante Associates
XL-64MTn5;nec tempus;Primis Corporation
aG2PI12;at, nisi. Cum sociis natoque penatibus;Pellentesque Foundation
ys+84_D2;semper;Nec Ante Associates
o2II5-N;neque.;Sagittis Duis
OP-38RUm8;sem semper erat, in consectetuer ipsum nunc id enim.;Primis Corporation
aQ4CI44;nascetur ridiculus mus. Proin vel nisl.;Pellentesque Foundation
sq+85_N8;mauris elit, dictum;Nec Ante Associates
KO-14CRy3;enim commodo hendrerit. Donec;Primis Corporation
NJ-32HDn2;lectus. Nullam suscipit, est ac facilisis facilisis, magna;Primis Corporation
iT7GC85;tempor arcu. Vestibulum ut eros non enim commodo hendrerit.;Pellentesque Foundation
bs+57_L2;luctus. Curabitur;Nec Ante Associates
UM-83QIn8;dui. Cras pellentesque. Sed dictum. Proin eget odio. Aliquam vulputate;Primis Corporation
oF3UF64;felis. Nulla;Pellentesque Foundation
ki+67_D3;eleifend non, dapibus rutrum,;Nec Ante Associates
oX4PJ47;nascetur ridiculus mus. Aenean eget magna. Suspendisse tristique neque venenatis;Pellentesque Foundation
nq+64_S2;lobortis mauris. Suspendisse aliquet molestie tellus. Aenean egestas hendrerit;Nec Ante Associates
TJ-63FAy6;semper pretium neque.;Primis Corporation
eQ7HO78;Aliquam erat volutpat. Nulla dignissim. Maecenas ornare egestas;Pellentesque Foundation
iR6DP45;non, feugiat nec, diam. Duis mi enim, condimentum eget,;Pellentesque Foundation
oX8GF82;Integer id magna et ipsum;Pellentesque Foundation
o8OO6-S;odio sagittis semper.;Sagittis Duis
a3EA7-A;orci, in consequat enim diam vel arcu. Curabitur;Sagittis Duis
a2IO5-W;lectus rutrum urna, nec luctus felis;Sagittis Duis
bu+71_I9;semper egestas, urna justo faucibus;Nec Ante Associates
PG-20BMu5;convallis est, vitae sodales;Primis Corporation
o6EE7-Y;enim. Etiam gravida molestie arcu. Sed eu nibh vulputate mauris;Sagittis Duis
FX-35EFm7;consequat, lectus sit amet luctus vulputate,;Primis Corporation
gn+13_H3;dui, nec tempus mauris erat eget ipsum.;Nec Ante Associates
e0UE3-X;felis orci,;Sagittis Duis
i5EO1-R;fames ac turpis egestas.;Sagittis Duis
i8AA6-T;Mauris ut quam vel sapien imperdiet ornare. In faucibus.;Sagittis Duis
DP-58PEw5;sem. Nulla interdum. Curabitur dictum. Phasellus;Primis Corporation
jk+88_V2;libero et tristique pellentesque,;Nec Ante Associates
e7EO1-Z;dignissim. Maecenas ornare egestas ligula. Nullam feugiat placerat velit.;Sagittis Duis
eN7SE76;elementum at, egestas a, scelerisque sed, sapien. Nunc;Pellentesque Foundation
oS1CL37;vitae semper egestas, urna justo faucibus lectus, a;Pellentesque Foundation
aB1TV43;sagittis. Nullam vitae diam.;Pellentesque Foundation
e7IE9-H;dapibus id, blandit at,;Sagittis Duis
i7AI6-O;justo nec ante. Maecenas mi felis, adipiscing fringilla,;Sagittis Duis
rm+46_M1;turpis egestas. Fusce aliquet magna a neque. Nullam ut;Nec Ante Associates
vv+09_H9;Phasellus in felis. Nulla tempor augue ac ipsum. Phasellus;Nec Ante Associates
oB5RT65;eu elit. Nulla facilisi. Sed;Pellentesque Foundation
VQ-88SWn2;pede sagittis;Primis Corporation
XG-19MDb8;aliquet, metus urna convallis erat, eget tincidunt dui;Primis Corporation
VW-25RIb6;Nulla tempor augue;Primis Corporation
cr+15_W8;Donec dignissim magna a tortor. Nunc commodo;Nec Ante Associates
LW-63LNl7;amet lorem semper auctor. Mauris vel turpis.;Primis Corporation
DJ-54YIc4;sit amet, dapibus;Primis Corporation
i5EU3-D;non, luctus sit;Sagittis Duis
uR3HZ85;amet, faucibus ut, nulla. Cras eu;Pellentesque Foundation
aY2KM17;odio.;Pellentesque Foundation
bm+25_D3;pellentesque a, facilisis non, bibendum sed, est.;Nec Ante Associates
oV1GL76;nibh sit amet orci. Ut sagittis lobortis mauris. Suspendisse;Pellentesque Foundation
eH1CY16;lectus. Cum sociis natoque penatibus et magnis dis parturient;Pellentesque Foundation
o8EO5-J;sed, est. Nunc laoreet lectus quis;Sagittis Duis
UX-73WGn5;at pede.;Primis Corporation
XE-81FDn2;a, magna. Lorem ipsum dolor sit amet, consectetuer adipiscing;Primis Corporation
CK-41SYe6;sem. Pellentesque ut;Primis Corporation
WY-13UNk6;sagittis. Nullam vitae diam.;Primis Corporation
oE5KF78;bibendum fermentum metus. Aenean;Pellentesque Foundation
PP-66TNl4;Donec luctus aliquet odio. Etiam ligula tortor, dictum;Primis Corporation
SO-64DNb8;Duis;Primis Corporation
uL4PY87;sem mollis dui, in;Pellentesque Foundation
o4II3-B;libero et tristique pellentesque, tellus sem mollis dui,;Sagittis Duis
i4IA2-L;ante. Maecenas mi felis, adipiscing fringilla, porttitor vulputate, posuere;Sagittis Duis
NI-62CQe4;vulputate velit eu sem. Pellentesque;Primis Corporation
i7OA2-B;Vestibulum ut;Sagittis Duis
om+57_X2;euismod urna. Nullam lobortis quam a;Nec Ante Associates
o5OU8-Q;ac urna. Ut tincidunt;Sagittis Duis
IL-27CGi4;eu dolor egestas rhoncus. Proin;Primis Corporation
sr+84_F5;consectetuer,;Nec Ante Associates
aO2NZ86;id ante dictum cursus. Nunc mauris elit, dictum;Pellentesque Foundation
e1UO4-M;Integer sem;Sagittis Duis
u9AI3-G;magna nec quam. Curabitur;Sagittis Duis
fj+03_X8;Nulla eget metus eu erat semper rutrum.;Nec Ante Associates
ye+14_R7;Nullam feugiat placerat velit. Quisque varius. Nam;Nec Ante Associates
iq+32_F6;dolor;Nec Ante Associates
EC-76WNw3;et malesuada fames ac turpis egestas. Fusce;Primis Corporation
cp+30_T5;condimentum. Donec at arcu.;Nec Ante Associates
aB5DH32;et, euismod et, commodo at, libero.;Pellentesque Foundation
aI8JT44;enim. Etiam imperdiet dictum magna. Ut;Pellentesque Foundation
eG1VC18;eget mollis lectus pede et risus.;Pellentesque Foundation
uF8CL74;Vivamus;Pellentesque Foundation
ZE-16CRv7;egestas. Fusce;Primis Corporation
VJ-33KOr8;Nam ac nulla. In tincidunt congue turpis. In;Primis Corporation
uk+38_G6;mauris sapien, cursus in, hendrerit;Nec Ante Associates
SD-69JZd2;purus. Maecenas libero est, congue a, aliquet vel,;Primis Corporation
nz+13_G2;Fusce dolor quam,;Nec Ante Associates
WM-38KVa7;interdum. Sed auctor odio a;Primis Corporation
uZ2IY38;ante lectus convallis est, vitae;Pellentesque Foundation
OS-02RVv2;Quisque ornare tortor at;Primis Corporation
eF0CE93;Donec dignissim;Pellentesque Foundation
PG-29ODq8;cursus. Integer;Primis Corporation
xh+16_Y2;pede,;Nec Ante Associates
ro+32_F5;egestas blandit. Nam;Nec Ante Associates
XY-74RPj6;at arcu. Vestibulum ante ipsum primis;Primis Corporation
