reference;libelle;marque
o4OI1-N;Integer;Sagittis Duis
AL-51GUb2;Nullam vitae diam. Proin dolor. Nulla;Primis Corporation
TN-31KTm2;ac turpis egestas. Aliquam fringilla cursus purus.;Primis Corporation
ee+63_H8;amet, consectetuer adipiscing;Nec Ante Associates
XR-21MEe8;Integer in;Primis Corporation
u5IE8-L;quam;Sagittis Duis
e9OI1-P;hendrerit. Donec porttitor tellus non;Sagittis Duis
DV-94GRt3;quis urna. Nunc quis arcu vel;Primis Corporation
e2EE8-Y;pellentesque a,;Sagittis Duis
xi+24_F5;dignissim pharetra. Nam ac nulla. In;Nec Ante Associates
iQ5NZ77;enim nec tempus scelerisque, lorem ipsum sodales purus,;Pellentesque Foundation
eS0KW76;mus. Donec dignissim magna a;Pellentesque Foundation
eu+45_I8;eu dui. Cum sociis natoque penatibus et magnis dis parturient;Nec Ante Associates
i2EE6-Q;Phasellus vitae;Sagittis Duis
QC-07POu7;pretium et, rutrum non, hendrerit id, ante. Nunc mauris;Primis Corporation
UJ-31WQp5;nisl. Nulla;Primis Corporation
zv+22_F4;Nulla aliquet. Proin velit.;Nec Ante Associates
PK-58EMe7;feugiat. Lorem ipsum dolor sit amet, consectetuer;Primis Corporation
de+13_K3;vitae erat vel pede blandit congue. In;Nec Ante Associates
a7OE1-Y;a mi fringilla mi;Sagittis Duis
GG-82XXq5;est ac mattis semper,;Primis Corporation
o5IO8-R;sed tortor. Integer aliquam adipiscing lacus. Ut;Sagittis Duis
u2II0-W;Cras vulputate;Sagittis Duis
DU-29CKi4;dolor. Donec fringilla. Donec feugiat metus sit amet ante. Vivamus;Primis Corporation
ng+12_T2;laoreet ipsum. Curabitur consequat, lectus;Nec Ante Associates
iQ7QH31;inceptos hymenaeos.;Pellentesque Foundation
GH-34HAg2;neque;Primis Corporation
WG-96ESk6;nonummy ut, molestie in, tempus eu, ligula.;Primis Corporation
lp+73_I6;arcu et pede. Nunc sed orci;Nec Ante Associates
o9EI8-Q;Sed auctor odio;Sagittis Duis
i7AO8-C;nunc sed pede. Cum sociis;Sagittis Duis
fc+37_F6;sem ut;Nec Ante Associates
CJ-18UIi5;lobortis quis, pede. Suspendisse dui. Fusce diam;Primis Corporation
co+33_U1;enim. Nunc ut erat.;Nec Ante Associates
NN-38SVv2;tellus. Nunc;Primis Corporation
u2IU9-L;eget metus eu erat;Sagittis Duis
cy+37_G5;nec, eleifend non,;Nec Ante Associates
uU3MJ79;dui quis accumsan convallis, ante lectus convallis est,;Pellentesque Foundation
o9UA7-V;quis urna. Nunc quis arcu vel quam;Sagittis Duis
HY-41OLd8;amet ante. Vivamus non lorem;Primis Corporation
o3IO3-D;tincidunt dui augue eu tellus. Phasellus;Sagittis Duis
a3OE3-T;Nullam feugiat placerat velit. Quisque varius. Nam porttitor scelerisque;Sagittis Duis
o4EO3-V;a mi fringilla mi lacinia mattis. Integer eu;Sagittis Duis
JD-53BFv6;enim. Etiam;Primis Corporation
e5EO7-U;eu arcu. Morbi sit amet massa. Quisque porttitor eros nec;Sagittis Duis
tb+12_P7;iaculis quis, pede. Praesent;Nec Ante Associates
XQ-20SSo7;inceptos hymenaeos. Mauris ut quam vel sapien;Primis Corporation
IZ-66ENk5;sed tortor. Integer aliquam adipiscing;Primis Corporation
eQ6UR66;est. Nunc laoreet lectus quis massa. Mauris vestibulum,;Pellentesque Foundation
SS-64DFh5;Nulla aliquet. Proin velit. Sed;Primis Corporation
u0IU4-X;tellus. Phasellus elit pede, malesuada vel,;Sagittis Duis
OD-76MIf8;a, enim. Suspendisse;Primis Corporation
oO8DD34;sem ut dolor dapibus gravida. Aliquam tincidunt,;Pellentesque Foundation
aL1EI35;purus;Pellentesque Foundation
u7EE4-O;tincidunt adipiscing. Mauris;Sagittis Duis
o5EI7-U;arcu;Sagittis Duis
o5OA3-K;Nunc lectus pede, ultrices;Sagittis Duis
oA5CN43;placerat.;Pellentesque Foundation
bp+02_Q4;pharetra, felis eget varius ultrices, mauris ipsum;Nec Ante Associates
VL-60MKj3;pede sagittis augue, eu tempor erat neque non quam.;Primis Corporation
UJ-96ATd6;tempus, lorem fringilla;Primis Corporation
ES-61EKg2;dictum mi, ac mattis velit justo nec;Primis Corporation
e6AO8-F;ornare tortor at;Sagittis Duis
WF-51BCn4;dolor dolor, tempus non, lacinia at, iaculis quis, pede.;Primis Corporation
RO-71ZEc7;elementum;Primis Corporation
em+00_M5;ad litora torquent per conubia nostra, per inceptos;Nec Ante Associates
RL-67DCx4;lobortis tellus;Primis Corporation
i5AE6-Y;ultrices sit amet,;Sagittis Duis
ou+12_G2;lacinia mattis. Integer eu lacus. Quisque imperdiet,;Nec Ante Associates
WX-13EUb4;urna. Nunc quis arcu vel quam dignissim;Primis Corporation
a6EI3-J;Nunc mauris. Morbi;Sagittis Duis
e6OI0-Q;ligula. Nullam enim. Sed nulla ante, iaculis nec,;Sagittis Duis
e5UA6-V;penatibus et magnis dis parturient montes, nascetur ridiculus;Sagittis Duis
GS-33RWt3;Sed malesuada augue ut lacus. Nulla tincidunt, neque vitae;Primis Corporation
eB2XS24;luctus vulputate,;Pellentesque Foundation
e3OU2-K;euismod urna. Nullam lobortis quam a felis ullamcorper viverra.;Sagittis Duis
oU2MP23;penatibus et;Pellentesque Foundation
QU-18YIq3;malesuada malesuada. Integer id magna et;Primis Corporation
rg+88_J9;quam dignissim pharetra. Nam ac nulla.;Nec Ante Associates
a7OI8-T;felis. Nulla tempor augue ac;Sagittis Duis
o4OA4-I;nisi a odio semper cursus. Integer mollis. Integer tincidunt;Sagittis Duis
CB-24TJv2;Donec tempus, lorem fringilla ornare placerat, orci;Primis Corporation
iC7PC76;consequat enim diam vel arcu.;Pellentesque Foundation
nb+97_S5;et, eros. Proin ultrices. Duis volutpat nunc sit;Nec Ante Associates
LF-64SIb2;nibh. Quisque nonummy ipsum non arcu. Vivamus;Primis Corporation
i6OI5-Y;lorem ut aliquam iaculis, lacus pede sagittis augue, eu tempor;Sagittis Duis
uL2OB35;ipsum primis;Pellentesque Foundation
lk+17_C6;non, vestibulum nec, euismod in, dolor. Fusce feugiat. Lorem;Nec Ante Associates
aT7XV83;volutpat. Nulla dignissim. Maecenas ornare egestas ligula. Nullam feugiat;Pellentesque Foundation
MO-73RXt9;quam. Pellentesque habitant;Primis Corporation
NC-28CKl9;neque. Sed eget lacus.;Primis Corporation
i9OE0-Y;tempus scelerisque, lorem ipsum sodales purus, in molestie tortor nibh;Sagittis Duis
eP2XE47;malesuada vel, convallis in, cursus;Pellentesque Foundation
UL-11OOk4;penatibus et magnis dis parturient montes, nascetur ridiculus;Primis Corporation
wt+69_J5;urna. Ut tincidunt vehicula risus. Nulla;Nec Ante Associates
eT6NZ33;lorem eu metus.;Pellentesque Foundation
HL-56OTe3;lobortis. Class aptent taciti sociosqu ad litora torquent;Primis Corporation
oC2WQ22;augue. Sed molestie. Sed id risus quis;Pellentesque Foundation
LX-52HRu3;pede. Cras vulputate velit eu sem. Pellentesque;Primis Corporation
a8OI1-Q;Integer vulputate, risus a ultricies adipiscing,;Sagittis Duis
TZ-13LFn2;pede ac urna. Ut tincidunt vehicula;Primis Corporation
TW-43GUr3;Etiam gravida molestie arcu. Sed eu;Primis Corporation
eI9OI72;consequat, lectus sit amet luctus vulputate, nisi sem;Pellentesque Foundation
u6EI7-F;sed turpis;Sagittis Duis
eL4YE39;tempus;Pellentesque Foundation
ah+35_M5;Vivamus sit amet risus. Donec;Nec Ante Associates
YU-27IQw2;justo eu arcu.;Primis Corporation
e7IE8-I;ante dictum cursus. Nunc mauris elit, dictum eu, eleifend nec,;Sagittis Duis
UH-81DIv7;turpis egestas. Aliquam fringilla cursus purus. Nullam scelerisque neque;Primis Corporation
eO7MJ99;velit. Pellentesque ultricies;Pellentesque Foundation
iO2IK47;sem ut cursus;Pellentesque Foundation
iS4OK35;dui, semper et, lacinia vitae, sodales at, velit.;Pellentesque Foundation
i7OI1-R;a odio semper cursus. Integer mollis. Integer tincidunt aliquam arcu.;Sagittis Duis
GB-64MAn5;amet,;Primis Corporation
LH-85KAy2;nec luctus;Primis Corporation
oF1KV27;justo. Proin;Pellentesque Foundation
i3IO6-D;ipsum dolor;Sagittis Duis
i3II3-N;Integer id magna et;Sagittis Duis
BM-77IYu2;montes, nascetur ridiculus mus. Proin;Primis Corporation
oU5QP44;odio. Aliquam vulputate ullamcorper;Pellentesque Foundation
XK-32KTe5;dapibus ligula. Aliquam erat volutpat. Nulla dignissim. Maecenas ornare;Primis Corporation
e4IU7-O;eget tincidunt dui augue;Sagittis Duis
u5IO7-W;metus. Aenean sed pede nec ante blandit viverra.;Sagittis Duis
GT-52OLl5;erat. Sed nunc est, mollis non, cursus non,;Primis Corporation
CS-13IIq7;a mi fringilla mi lacinia mattis. Integer eu;Primis Corporation
HH-14VTd7;eu metus. In lorem. Donec elementum, lorem ut;Primis Corporation
e7AA4-V;Nulla aliquet. Proin velit. Sed malesuada augue ut;Sagittis Duis
jv+64_J3;scelerisque sed, sapien. Nunc pulvinar arcu et pede. Nunc sed;Nec Ante Associates
u4EO6-L;pellentesque massa lobortis ultrices. Vivamus rhoncus. Donec est.;Sagittis Duis
VJ-36CDo2;sed dictum eleifend, nunc risus varius orci, in consequat;Primis Corporation
qr+24_P7;et, lacinia vitae, sodales;Nec Ante Associates
GK-42QRn6;amet, consectetuer;Primis Corporation
zr+35_M6;est tempor;Nec Ante Associates
uV9MF76;erat,;Pellentesque Foundation
bi+74_T5;elementum at, egestas a, scelerisque sed,;Nec Ante Associates
FL-88ZYt7;nec tempus;Primis Corporation
uM4MA45;risus, at fringilla purus mauris a nunc. In;Pellentesque Foundation
QT-36LOc8;nunc sit amet;Primis Corporation
iQ8YF78;dolor. Fusce mi lorem, vehicula et,;Pellentesque Foundation
RV-19UAa2;Vivamus non lorem;Primis Corporation
OZ-47JGa9;lobortis tellus justo sit amet;Primis Corporation
i3AE1-Z;ut erat.;Sagittis Duis
EC-59SEx7;at fringilla purus mauris a nunc. In at pede. Cras;Primis Corporation
ue+33_P2;turpis non enim. Mauris quis;Nec Ante Associates
a9EI4-F;Curabitur vel lectus. Cum;Sagittis Duis
iH8TC63;sem egestas blandit. Nam nulla magna, malesuada vel,;Pellentesque Foundation
OC-18ZZt3;mauris id sapien. Cras dolor dolor, tempus non, lacinia at,;Primis Corporation
i5AE9-I;tempus risus. Donec;Sagittis Duis
UN-43QMr2;lacinia vitae, sodales at, velit. Pellentesque ultricies dignissim lacus.;Primis Corporation
JC-11YIr5;Pellentesque habitant morbi;Primis Corporation
VY-35TFe8;ultrices posuere cubilia Curae Phasellus;Primis Corporation
u7AI5-V;auctor. Mauris;Sagittis Duis
UJ-96KZi3;Proin;Primis Corporation
o4EO2-W;commodo at, libero. Morbi accumsan laoreet ipsum.;Sagittis Duis
i0OA4-N;fermentum vel, mauris. Integer sem elit, pharetra;Sagittis Duis
ON-52OZs8;amet, consectetuer adipiscing;Primis Corporation
eD3EF83;Phasellus nulla. Integer vulputate, risus a;Pellentesque Foundation
xh+53_H5;auctor quis,;Nec Ante Associates
eZ3HH51;volutpat. Nulla;Pellentesque Foundation
UB-43NJd6;Aenean egestas;Primis Corporation
VR-76ZPp7;tellus non magna.;Primis Corporation
uW6EO19;sollicitudin adipiscing ligula. Aenean gravida nunc sed pede.;Pellentesque Foundation
PK-71WNi8;eu, euismod ac, fermentum vel, mauris. Integer;Primis Corporation
e7EA2-D;tempor, est ac mattis semper,;Sagittis Duis
sy+33_L6;tellus. Nunc;Nec Ante Associates
WL-81TYs2;Nunc ac sem ut dolor;Primis Corporation
hi+88_D4;lorem, luctus ut,;Nec Ante Associates
ov+64_U3;amet diam eu dolor egestas rhoncus. Proin;Nec Ante Associates
oX0MQ79;Proin;Pellentesque Foundation
oy+38_G4;metus eu erat semper rutrum. Fusce dolor quam, elementum;Nec Ante Associates
iO6GN37;in molestie tortor;Pellentesque Foundation
HX-55NCe7;sem semper erat, in consectetuer;Primis Corporation
CH-63MTs2;quam quis diam. Pellentesque habitant morbi;Primis Corporation
HP-11PPf8;fames ac turpis egestas. Fusce aliquet;Primis Corporation
WG-51NKh4;est, vitae sodales nisi magna sed dui. Fusce aliquam,;Primis Corporation
o5EA7-H;viverra. Maecenas iaculis aliquet diam. Sed diam;Sagittis Duis
jh+91_J4;lacus vestibulum lorem, sit;Nec Ante Associates
o4II8-W;ligula. Donec luctus aliquet odio. Etiam ligula tortor, dictum;Sagittis Duis
XF-02JKz1;Donec feugiat metus sit amet;Primis Corporation
eF8MF89;hendrerit id, ante. Nunc mauris sapien, cursus in, hendrerit;Pellentesque Foundation
i7UE4-X;ante blandit viverra. Donec tempus, lorem fringilla;Sagittis Duis
AR-86LXy4;sed,;Primis Corporation
qd+95_M9;tellus. Aenean egestas hendrerit neque. In ornare sagittis felis. Donec;Nec Ante Associates
u3OE1-W;accumsan sed, facilisis vitae, orci. Phasellus dapibus quam;Sagittis Duis
DM-57GNg4;lobortis ultrices.;Primis Corporation
YL-28MLl4;ullamcorper.;Primis Corporation
AD-88USc6;tempor arcu.;Primis Corporation
oH2FJ23;nisi magna sed dui. Fusce aliquam, enim nec tempus;Pellentesque Foundation
o4AE4-S;ligula. Nullam feugiat;Sagittis Duis
i4OA1-P;dolor sit amet, consectetuer adipiscing;Sagittis Duis
aK2FH63;nulla. Integer urna. Vivamus molestie dapibus ligula. Aliquam erat;Pellentesque Foundation
hr+84_H2;erat volutpat. Nulla dignissim. Maecenas ornare egestas;Nec Ante Associates
iH2OG74;interdum. Sed auctor odio a;Pellentesque Foundation
CT-22BMi3;odio sagittis semper. Nam tempor;Primis Corporation
VN-18HFh4;rhoncus. Donec est. Nunc ullamcorper, velit in;Primis Corporation
sg+77_Z7;sed sem egestas blandit. Nam;Nec Ante Associates
KT-83QXe7;velit justo nec ante. Maecenas;Primis Corporation
eY3SO93;amet metus.;Pellentesque Foundation
FM-66SXu5;dis parturient;Primis Corporation
JF-73WBi9;sapien, gravida non, sollicitudin;Primis Corporation
a8UI1-J;egestas hendrerit neque. In ornare sagittis;Sagittis Duis
iS5XH52;a sollicitudin orci;Pellentesque Foundation
BB-71IZp3;erat. Sed nunc est, mollis non, cursus non, egestas a,;Primis Corporation
eD1JE64;cubilia Curae Donec tincidunt. Donec vitae erat vel pede blandit;Pellentesque Foundation
iB5ZI82;urna justo faucibus lectus, a sollicitudin orci sem eget;Pellentesque Foundation
PG-28VAd4;senectus et netus et malesuada fames ac turpis;Primis Corporation
oC7WE12;magna tellus faucibus leo, in lobortis;Pellentesque Foundation
qf+21_E7;metus. In nec orci. Donec nibh. Quisque nonummy;Nec Ante Associates
MX-75VXq3;vitae, posuere at, velit. Cras lorem;Primis Corporation
e7UO2-T;fringilla. Donec feugiat metus sit amet ante. Vivamus non;Sagittis Duis
sw+98_L3;amet massa. Quisque porttitor eros nec tellus.;Nec Ante Associates
FE-96FLb3;erat, eget tincidunt dui augue eu tellus. Phasellus;Primis Corporation
HG-99DEc4;mattis. Cras eget nisi dictum;Primis Corporation
oH6MN62;sem mollis dui, in sodales elit;Pellentesque Foundation
oY9SC58;fames ac turpis egestas. Aliquam fringilla cursus purus. Nullam;Pellentesque Foundation
iK1VS27;placerat, orci lacus vestibulum lorem,;Pellentesque Foundation
NZ-14CIz7;ultricies adipiscing, enim mi tempor lorem, eget mollis;Primis Corporation
TN-92APm6;parturient;Primis Corporation
LW-44ORy7;egestas. Duis ac arcu.;Primis Corporation
tw+53_R1;rutrum, justo.;Nec Ante Associates
u4AO9-S;magna, malesuada vel, convallis in, cursus et,;Sagittis Duis
u2OA2-H;tellus eu augue;Sagittis Duis
iY2NY71;augue id ante;Pellentesque Foundation
qz+63_U2;quis, pede. Praesent eu dui. Cum sociis natoque penatibus et;Nec Ante Associates
EB-67GBo3;et, commodo at, libero. Morbi accumsan laoreet ipsum. Curabitur;Primis Corporation
PX-58RAs8;ipsum leo elementum sem,;Primis Corporation
IM-02HPc6;et netus et malesuada fames ac turpis;Primis Corporation
e2OI6-Z;velit. Sed malesuada augue ut;Sagittis Duis
a4EU8-M;non, luctus sit amet, faucibus ut, nulla. Cras eu;Sagittis Duis
i6EO8-U;malesuada fringilla est. Mauris;Sagittis Duis
YB-57PFs7;Mauris quis turpis vitae purus gravida sagittis. Duis;Primis Corporation
TZ-80OKw1;scelerisque neque sed sem egestas;Primis Corporation
e3IO0-D;felis.;Sagittis Duis
WB-10MSb2;posuere at, velit. Cras lorem lorem, luctus ut, pellentesque;Primis Corporation
aC7UY56;ac libero nec ligula consectetuer rhoncus. Nullam velit dui,;Pellentesque Foundation
oU7IS68;malesuada fringilla est. Mauris eu turpis.;Pellentesque Foundation
oC4NK65;dui, in;Pellentesque Foundation
u8OO3-M;arcu. Vivamus sit amet risus.;Sagittis Duis
op+80_U5;velit eu sem.;Nec Ante Associates
td+81_V4;dui nec urna suscipit nonummy. Fusce fermentum;Nec Ante Associates
PO-21PFd6;lorem semper auctor. Mauris vel;Primis Corporation
a1UI9-D;congue, elit sed consequat;Sagittis Duis
vx+05_O7;nec tempus mauris;Nec Ante Associates
o9EU7-R;vel turpis. Aliquam adipiscing lobortis;Sagittis Duis
i5OO5-Z;Morbi vehicula. Pellentesque tincidunt tempus risus. Donec egestas. Duis;Sagittis Duis
GD-76MXz3;risus, at;Primis Corporation
VI-13MKm8;purus sapien, gravida;Primis Corporation
gw+07_V9;metus;Nec Ante Associates
YV-83LMt6;tincidunt congue turpis. In condimentum.;Primis Corporation
o9IU6-J;Donec vitae erat vel;Sagittis Duis
o3AI5-L;eget tincidunt dui augue eu;Sagittis Duis
oN7XI73;ut, nulla. Cras eu tellus;Pellentesque Foundation
uC5TU77;metus sit amet ante. Vivamus non lorem;Pellentesque Foundation
i4AO0-B;tincidunt orci quis lectus. Nullam suscipit, est ac;Sagittis Duis
NG-82ZNi7;Sed eget lacus. Mauris non;Primis Corporation
iL1LH28;vehicula;Pellentesque Foundation
oV5EQ87;montes, nascetur;Pellentesque Foundation
YK-44LIb7;non,;Primis Corporation
uO5GN89;Integer id magna et;Pellentesque Foundation
iQ5YC33;fringilla purus mauris a nunc. In at pede. Cras vulputate;Pellentesque Foundation
a8IA7-F;adipiscing elit. Aliquam auctor, velit;Sagittis Duis
o6OA4-O;pede, ultrices a, auctor non, feugiat nec, diam.;Sagittis Duis
e5OE6-T;non, vestibulum;Sagittis Duis
iA2YB62;et tristique pellentesque, tellus sem mollis dui,;Pellentesque Foundation
e5OI3-Z;ac, feugiat non, lobortis quis, pede. Suspendisse dui.;Sagittis Duis
e8EE5-C;dui lectus rutrum urna, nec luctus felis;Sagittis Duis
iX2VD88;vitae erat vel pede blandit;Pellentesque Foundation
FV-75WWd8;lorem, auctor quis, tristique;Primis Corporation
aS9BP96;gravida molestie arcu.;Pellentesque Foundation
su+64_I9;enim.;Nec Ante Associates
i2IE8-V;dolor sit amet, consectetuer adipiscing elit. Etiam laoreet, libero;Sagittis Duis
wu+19_B6;urna convallis;Nec Ante Associates
e0EI5-H;ut mi. Duis risus odio, auctor vitae, aliquet nec,;Sagittis Duis
im+83_T5;pede. Cum sociis natoque penatibus et;Nec Ante Associates
dg+47_Y2;ad litora torquent per conubia nostra, per;Nec Ante Associates
WM-37JRa3;sit amet diam eu dolor;Primis Corporation
NH-10MIc7;porttitor vulputate, posuere vulputate, lacus.;Primis Corporation
eF1VE28;imperdiet ornare. In faucibus. Morbi;Pellentesque Foundation
e4IO4-H;velit in aliquet lobortis,;Sagittis Duis
eX8VH77;lacinia mattis. Integer eu lacus.;Pellentesque Foundation
oB3AP22;tortor, dictum eu, placerat eget, venenatis a, magna.;Pellentesque Foundation
a6OE4-P;nulla. Integer vulputate, risus a ultricies adipiscing, enim mi;Sagittis Duis
QD-28DIe8;elit. Nulla facilisi. Sed;Primis Corporation
fm+51_P6;non dui nec urna suscipit nonummy.;Nec Ante Associates
i8OI5-G;natoque penatibus et magnis dis parturient montes, nascetur ridiculus;Sagittis Duis
XQ-77QWg6;velit. Aliquam nisl.;Primis Corporation
iJ3SS57;sagittis. Nullam vitae diam. Proin dolor. Nulla;Pellentesque Foundation
OS-57ALi2;Nunc commodo auctor velit. Aliquam nisl. Nulla eu;Primis Corporation
WK-94FQh2;adipiscing elit. Aliquam auctor,;Primis Corporation
oR4OC15;ante. Nunc mauris sapien, cursus;Pellentesque Foundation
IT-82BUq1;Ut sagittis lobortis mauris. Suspendisse aliquet;Primis Corporation
yk+24_S2;egestas nunc;Nec Ante Associates
WE-38YTq8;neque.;Primis Corporation
XC-37PIm5;vehicula risus. Nulla eget metus;Primis Corporation
we+34_Y3;dolor, tempus non,;Nec Ante Associates
ko+68_U4;nunc, ullamcorper eu,;Nec Ante Associates
i4EU7-Y;nec luctus felis purus ac;Sagittis Duis
rv+24_L8;Suspendisse sed dolor.;Nec Ante Associates
oX2CX78;Nam ligula elit, pretium et, rutrum;Pellentesque Foundation
oO8EF28;enim. Suspendisse aliquet, sem ut cursus luctus,;Pellentesque Foundation
DF-63LSx7;metus;Primis Corporation
qn+56_W1;vitae risus. Duis a mi fringilla mi;Nec Ante Associates
fj+21_L4;habitant morbi;Nec Ante Associates
si+96_J6;blandit mattis. Cras;Nec Ante Associates
BX-30EQq6;Fusce aliquet magna a neque.;Primis Corporation
xc+58_K8;Integer id magna et ipsum cursus vestibulum. Mauris magna.;Nec Ante Associates
eF1TM31;ad litora torquent per conubia;Pellentesque Foundation
TF-61WHc7;egestas;Primis Corporation
wz+25_B2;sem. Pellentesque;Nec Ante Associates
bv+48_E3;est ac facilisis facilisis, magna tellus faucibus leo, in;Nec Ante Associates
oM2JJ88;torquent per;Pellentesque Foundation
sh+59_V1;Donec sollicitudin adipiscing ligula. Aenean gravida nunc sed;Nec Ante Associates
UC-12FJq4;euismod urna. Nullam lobortis quam a felis ullamcorper;Primis Corporation
aY1DC87;Duis cursus, diam at pretium aliquet,;Pellentesque Foundation
up+78_E4;amet risus.;Nec Ante Associates
PY-26KUx1;urna justo faucibus lectus, a sollicitudin orci;Primis Corporation
xc+72_B6;ut cursus luctus, ipsum leo elementum sem, vitae;Nec Ante Associates
oY1WV39;ac turpis egestas. Aliquam fringilla cursus purus. Nullam scelerisque neque;Pellentesque Foundation
i5UU5-E;taciti sociosqu ad litora torquent per conubia nostra, per inceptos;Sagittis Duis
YV-47FLd4;ornare, elit elit fermentum risus,;Primis Corporation
FI-99OZp4;nec luctus felis purus;Primis Corporation
KD-53QTp8;Proin;Primis Corporation
i7IU0-C;vitae, posuere at, velit. Cras lorem;Sagittis Duis
NW-60RNj2;varius et, euismod et, commodo at, libero. Morbi;Primis Corporation
CG-50LLu7;purus gravida sagittis. Duis gravida.;Primis Corporation
u2EI1-E;in consequat enim diam vel;Sagittis Duis
CA-75KIr3;laoreet ipsum. Curabitur consequat, lectus sit amet;Primis Corporation
eI0KX79;posuere, enim nisl elementum purus, accumsan;Pellentesque Foundation
FY-33LSh6;fermentum arcu. Vestibulum ante ipsum primis in faucibus orci;Primis Corporation
oS2BX67;tellus justo sit amet nulla. Donec non justo. Proin;Pellentesque Foundation
IB-42CMn5;vel sapien imperdiet ornare. In faucibus. Morbi vehicula.;Primis Corporation
SP-97AMk8;at, velit. Pellentesque ultricies dignissim lacus.;Primis Corporation
GD-21HMg8;non justo. Proin non massa non;Primis Corporation
JK-42NCy2;non, bibendum sed, est. Nunc laoreet lectus;Primis Corporation
KV-32QUz3;nisi a odio semper cursus. Integer mollis. Integer;Primis Corporation
HY-58PWg1;egestas. Aliquam fringilla;Primis Corporation
o1EE3-W;urna convallis erat, eget tincidunt dui augue;Sagittis Duis
IP-97CPy2;Praesent eu nulla at sem molestie sodales.;Primis Corporation
TU-24ZKd1;Donec luctus aliquet odio. Etiam ligula tortor, dictum eu,;Primis Corporation
QU-29DCq6;mauris.;Primis Corporation
GU-20BYu7;libero nec ligula consectetuer rhoncus. Nullam;Primis Corporation
ar+46_G2;mi felis, adipiscing fringilla, porttitor;Nec Ante Associates
oD6KI23;dictum. Proin eget odio. Aliquam vulputate ullamcorper;Pellentesque Foundation
a6II1-M;dolor. Donec fringilla. Donec feugiat metus sit amet ante.;Sagittis Duis
iN6PQ66;pretium neque. Morbi quis urna.;Pellentesque Foundation
u2OE8-N;enim, sit;Sagittis Duis
TD-48DOz5;Cras sed leo.;Primis Corporation
iS8AW42;a felis ullamcorper viverra. Maecenas iaculis aliquet;Pellentesque Foundation
NL-52RVc9;ipsum;Primis Corporation
OH-25QPs7;velit eget laoreet posuere, enim nisl elementum;Primis Corporation
mb+77_N4;Mauris eu turpis. Nulla;Nec Ante Associates
XB-14HKj6;Nam nulla;Primis Corporation
AJ-18EYe8;imperdiet ornare. In;Primis Corporation
WB-96AQe2;malesuada vel, venenatis vel, faucibus id, libero. Donec consectetuer mauris;Primis Corporation
a6IU2-S;a felis ullamcorper viverra.;Sagittis Duis
i1IO9-J;feugiat metus sit amet ante. Vivamus non lorem;Sagittis Duis
oD5AS56;rutrum urna, nec luctus felis purus ac tellus.;Pellentesque Foundation
a9OO7-B;ac mattis velit;Sagittis Duis
uA5PF63;nec, euismod in, dolor. Fusce feugiat. Lorem ipsum;Pellentesque Foundation
LZ-21OWt3;diam vel arcu.;Primis Corporation
QM-16VKm2;luctus felis purus ac tellus. Suspendisse sed;Primis Corporation
kq+27_V5;Aliquam erat volutpat. Nulla;Nec Ante Associates
GK-89NNm8;dolor sit amet, consectetuer adipiscing elit. Curabitur sed tortor.;Primis Corporation
dj+93_K3;ad litora torquent per conubia;Nec Ante Associates
zf+82_K3;dictum. Proin eget odio. Aliquam vulputate ullamcorper;Nec Ante Associates
RL-37CEn6;dolor dapibus gravida. Aliquam tincidunt, nunc ac;Primis Corporation
IF-66BCd6;Suspendisse non leo.;Primis Corporation
dn+71_R8;lorem tristique aliquet. Phasellus fermentum convallis ligula. Donec luctus aliquet;Nec Ante Associates
e2UU9-P;Morbi quis urna. Nunc quis arcu vel quam dignissim;Sagittis Duis
kg+08_Z8;mauris;Nec Ante Associates
i2EE4-T;quis lectus. Nullam suscipit, est;Sagittis Duis
lh+87_F1;a purus. Duis elementum, dui quis accumsan convallis,;Nec Ante Associates
NM-76MJf2;quis urna. Nunc quis arcu vel quam;Primis Corporation
KW-77BDf7;ante. Maecenas;Primis Corporation
a9OO4-F;Duis ac arcu. Nunc mauris. Morbi non;Sagittis Duis
LS-10RYc5;malesuada vel, venenatis vel, faucibus;Primis Corporation
MU-73VYh4;urna. Nunc quis arcu vel;Primis Corporation
YH-13IFk3;faucibus. Morbi;Primis Corporation
QB-24JSl6;eu;Primis Corporation
sw+27_Z3;ultricies adipiscing, enim mi tempor lorem,;Nec Ante Associates
i7IO8-L;nisi. Aenean eget metus. In nec orci. Donec nibh. Quisque;Sagittis Duis
HU-51KMu6;ac orci. Ut semper pretium neque. Morbi;Primis Corporation
ue+36_Q8;Etiam gravida molestie arcu. Sed eu nibh;Nec Ante Associates
i2EO0-X;vel;Sagittis Duis
qx+11_Y2;mollis nec, cursus a, enim. Suspendisse aliquet, sem;Nec Ante Associates
vn+11_S9;Morbi sit amet massa. Quisque porttitor;Nec Ante Associates
a9EE7-X;sollicitudin a, malesuada id, erat. Etiam vestibulum;Sagittis Duis
HJ-57UVg4;conubia nostra, per inceptos hymenaeos. Mauris ut;Primis Corporation
HJ-70PTt3;libero. Donec consectetuer;Primis Corporation
o3EO5-K;nisi. Aenean eget metus. In nec orci.;Sagittis Duis
bi+35_T9;et ipsum cursus;Nec Ante Associates
wt+93_E9;metus urna convallis erat,;Nec Ante Associates
ru+81_K2;Mauris quis turpis vitae purus;Nec Ante Associates
LJ-69QQj2;Phasellus dolor elit, pellentesque a, facilisis;Primis Corporation
i7UO2-F;amet, faucibus ut,;Sagittis Duis
i8EE2-U;torquent per conubia nostra, per inceptos;Sagittis Duis
DD-46NUn4;mauris eu elit.;Primis Corporation
e2UI6-W;quam. Pellentesque habitant morbi;Sagittis Duis
oC9EV83;in faucibus;Pellentesque Foundation
i1AE7-S;mattis semper, dui lectus rutrum urna, nec luctus felis;Sagittis Duis
o8AU4-T;scelerisque neque. Nullam nisl. Maecenas malesuada fringilla est. Mauris;Sagittis Duis
e3EE4-Q;Fusce diam nunc, ullamcorper eu, euismod;Sagittis Duis
qa+43_F2;dui quis accumsan convallis, ante lectus convallis est,;Nec Ante Associates
oZ4NN32;Donec fringilla. Donec feugiat metus sit amet ante. Vivamus non;Pellentesque Foundation
mb+56_N4;ante. Maecenas mi felis, adipiscing fringilla, porttitor;Nec Ante Associates
RX-28UOi2;non, cursus non, egestas a, dui. Cras pellentesque. Sed;Primis Corporation
